{
  "$schema": "https://json-schema.org/draft/2020-12/schema",
  "$id": "https://zurvival.example/schemas/zombie.schema.json",
  "title": "Zombie type",
  "description": "A distinct zombie type (FR-CBT-07). Static definition only; the behavioural tags are read by the T25 state machine, and placement is per node via NodeState.zombieTypes. M2 ships the walker baseline plus the Screamer and Stalker.",
  "type": "object",
  "required": ["id", "name", "description"],
  "additionalProperties": false,
  "properties": {
    "$schema": { "type": "string", "description": "Optional editor hint pointing at this schema." },
    "id": { "type": "string", "pattern": "^zombie\\.[a-z0-9]+(?:[-_][a-z0-9]+)*$", "description": "Stable content id of the form zombie.<slug>." },
    "name": { "type": "string", "minLength": 1, "description": "Player-facing name (ICU MessageFormat string)." },
    "description": { "type": "string", "minLength": 1, "description": "How the type reads in a Scene (ICU MessageFormat string)." },
    "rousesNeighbours": { "type": "boolean", "description": "On reaching investigating/chasing, deposits noise into adjacent nodes (Screamer, FR-CBT-07)." },
    "nightHunter": { "type": "boolean", "description": "Drives toward chasing at night when the player is near (Stalker, FR-CBT-07)." },
    "notes": { "type": "string", "description": "Author commentary (JSON has no comments, ADR-0002)." }
  }
}
